{
  "contract_version": "atlas.ui.standard-registry.v1",
  "program_id": "atlas-ui-standards",
  "program_version": "1.0.0",
  "registry_status": "foundation",
  "published_at": "2026-07-15T12:00:00Z",
  "authority": {
    "root_owner": "ATLAS root",
    "implementation_owner": "each owner repository",
    "doctrine_owner": "Playbook",
    "board_writer": "owner.fawxzzyweb for product-board continuation and platform.supabase-migration for master-data work after exact contracts are proven; DiscordOS is retired provenance only",
    "mutation_authorized": false
  },
  "provenance": [
    {
      "source_id": "deep-research-2026-07-15",
      "ref": "data/imports/ui-standards/deep-research-2026-07-15/deep-research-report.md",
      "sha256": "77f882e6af10eb4094e79033769ab8d8010ba2e6d473c620ef55750340941723",
      "classification": "external-input",
      "disposition": "reference-only"
    },
    {
      "source_id": "atlas-qa-llel-v1",
      "ref": "docs/standards/ATLAS-QA-LLEL.md",
      "sha256": null,
      "classification": "verified",
      "disposition": "retain"
    },
    {
      "source_id": "atlas-ui-mutation-doctrine",
      "ref": "docs/ops/ATLAS-ROOT-UI-MUTATION-DISCIPLINE-AND-LIVE-DATA-SAFETY-DOCTRINE-REFRESH-2026-06-27.md",
      "sha256": null,
      "classification": "verified",
      "disposition": "retain"
    },
    {
      "source_id": "atlas-contracts-v2",
      "ref": "docs/architecture/ATLAS-CONTRACTS-V2-SCOPE.md",
      "sha256": null,
      "classification": "verified",
      "disposition": "merge"
    },
    {
      "source_id": "playbook-doctrine-adoption",
      "ref": "docs/registry/ATLAS-PLAYBOOK-DOCTRINE-ADOPTION.json",
      "sha256": null,
      "classification": "verified",
      "disposition": "retain"
    }
  ],
  "source_hierarchy": [
    {
      "rank": 1,
      "source_id": "ui-standard-registry",
      "ref": "docs/registry/ATLAS-UI-STANDARDS-REGISTRY.v1.json",
      "authority": "ATLAS root",
      "canonical_for": ["standard identity", "standard version", "program lifecycle mapping", "adoption profiles", "metric definitions"],
      "may_not_override": ["owner implementation truth", "repo-native verification truth", "Playbook doctrine bodies"]
    },
    {
      "rank": 2,
      "source_id": "qa-llel-contracts",
      "ref": "docs/standards/ATLAS-QA-LLEL.md",
      "authority": "ATLAS root QA",
      "canonical_for": ["evidence tiers", "lens contracts", "promotion semantics", "release profiles", "waiver semantics"],
      "may_not_override": ["repo-native test results", "owner route intent"]
    },
    {
      "rank": 3,
      "source_id": "atlas-contracts",
      "ref": "packages/atlas-contracts",
      "authority": "ATLAS root contracts",
      "canonical_for": ["card lifecycle wire values", "evidence bundle semantics", "marker evidence", "knowledge candidates", "board events"],
      "may_not_override": ["owner implementation truth", "accepted owner board readback"]
    },
    {
      "rank": 4,
      "source_id": "owner-repository-truth",
      "ref": "stack.yaml",
      "authority": "each owner repository",
      "canonical_for": ["routes", "components", "tokens", "runtime behavior", "repo-local commands", "product decisions"],
      "may_not_override": ["shared contract meanings", "root marker policy", "another repository's truth"]
    },
    {
      "rank": 5,
      "source_id": "playbook-doctrine",
      "ref": "docs/registry/ATLAS-PLAYBOOK-DOCTRINE-ADOPTION.json",
      "authority": "Playbook",
      "canonical_for": ["promoted rules", "promoted patterns", "promoted failure modes", "governed skill identity"],
      "may_not_override": ["owner runtime truth", "unreviewed research recommendations", "Atlas adoption evidence"]
    },
    {
      "rank": 6,
      "source_id": "atlas-book-projection",
      "ref": "docs/atlas-book/README.md",
      "authority": "ATLAS Book",
      "canonical_for": ["durable truth-map projection", "receipt index", "restart summary"],
      "may_not_override": ["registry semantics", "owner truth", "Playbook doctrine", "runtime receipts"]
    },
    {
      "rank": 7,
      "source_id": "discordos-projection",
      "ref": "docs/atlas-book/03-operating-model.md",
      "authority": "ATLAS root governance (retired DiscordOS provenance only)",
      "canonical_for": ["historical board state", "historical publication state", "historical readback receipts"],
      "may_not_override": ["engineering proof", "registry semantics", "marker evidence"]
    }
  ],
  "lifecycle": {
    "program_states": ["unplanned", "planned", "ready", "in_progress", "review", "completed", "blocked"],
    "wire_contract": "atlas.card-record.v2",
    "wire_mapping": {
      "unplanned": "intake",
      "planned": "planning",
      "ready": "ready",
      "in_progress": "in-progress",
      "review": "review",
      "completed": "completed",
      "blocked": "blocked"
    },
    "allowed_transitions": [
      {"from": "unplanned", "to": ["planned", "blocked"]},
      {"from": "planned", "to": ["unplanned", "ready", "blocked"]},
      {"from": "ready", "to": ["planned", "in_progress", "blocked"]},
      {"from": "in_progress", "to": ["planned", "review", "blocked"]},
      {"from": "review", "to": ["in_progress", "completed", "blocked"]},
      {"from": "completed", "to": []},
      {"from": "blocked", "to": ["planned", "ready", "in_progress", "review"]}
    ],
    "completion_gate": [
      "Every linked audit finding is verified, superseded, or accepted through an unexpired governed exception.",
      "Every required evidence dimension has current evidence or an explicit not-applicable disposition allowed by the adopted profile.",
      "The requested-change checklist contains no failed, blocked, deferred, planned, or unplanned item.",
      "Repo-native verification and the adopted QA LLEL gate pass for the target revision.",
      "The Atlas CardRecord is in review before it enters completed.",
      "Board completion, if projected, is applied by owner.fawxzzyweb only after an exact product-board contract and readback; master-data work belongs to platform.supabase-migration after its exact data contract."
    ]
  },
  "evidence_dimensions": [
    {
      "dimension_id": "routes",
      "title": "Route and state coverage",
      "minimum_evidence": ["A frozen applicable route and state inventory", "A result per touched route family", "Stable route or surface identifiers"],
      "existing_contract_refs": ["atlas.qa.scenario.v1", "atlas.qa.result.v1", "atlas.ui.capture-map.v1"],
      "absence_policy": "block"
    },
    {
      "dimension_id": "devices",
      "title": "Device and browser lens coverage",
      "minimum_evidence": ["The profile-required lens set", "Viewport and browser engine lineage", "Physical or manual proof when the release profile requires it"],
      "existing_contract_refs": ["atlas.qa.lens.v1", "atlas.qa.capture_receipt.v1", "atlas.qa.manual_attestation.v1"],
      "absence_policy": "manual_required"
    },
    {
      "dimension_id": "accessibility",
      "title": "Accessibility conformance evidence",
      "minimum_evidence": ["WCAG 2.2 AA is the default target for web UI", "Automated checks are supplemented by keyboard, focus, zoom or reflow, and manual review appropriate to risk", "APG may guide widget behavior but is not a normative standard or a design system"],
      "existing_contract_refs": ["atlas.ui.audit-finding.v1", "atlas.qa.artifact.v1", "https://www.w3.org/TR/WCAG22/", "https://www.w3.org/WAI/ARIA/apg/about/introduction/"],
      "absence_policy": "block"
    },
    {
      "dimension_id": "visual",
      "title": "Deterministic visual evidence",
      "minimum_evidence": ["Browser or device-backed screenshots", "A governed baseline or explicit expected-change assertion when stability is claimed", "Digest and route or lens correlation"],
      "existing_contract_refs": ["atlas.ui.visual-proof.v1", "atlas.ui.proof-summary.v1", "atlas.qa.visual_baseline.v1"],
      "absence_policy": "block"
    },
    {
      "dimension_id": "runtime",
      "title": "Runtime and interaction truth",
      "minimum_evidence": ["Repo-native executable checks", "Interaction result for the critical path", "Console, network, trace, or API evidence when required by the scenario"],
      "existing_contract_refs": ["atlas.qa.test_evidence.v1", "atlas.qa.artifact.v1", "atlas.evidence-bundle.v2"],
      "absence_policy": "block"
    },
    {
      "dimension_id": "change_checklist",
      "title": "Requested-change reconciliation",
      "minimum_evidence": ["An itemized checklist created before mutation", "One terminal status and evidence link per requested change", "Canonical-surface propagation proof when sibling normalization is in scope"],
      "existing_contract_refs": ["AGENTS.md", "docs/architecture/VISUAL-CHANGE-WORKFLOW.md", "atlas.ui.remediation-card.v1"],
      "absence_policy": "block"
    }
  ],
  "enforcement_tiers": [
    {
      "tier_id": "local",
      "qa_modes": ["dry-run", "evidence"],
      "receipt_origins": ["local_dev"],
      "required_dimensions": ["routes", "devices", "accessibility", "visual", "runtime", "change_checklist"],
      "gate": "Changed-scope verification must be explicit; unavailable higher-tier evidence remains visible and cannot be called passed."
    },
    {
      "tier_id": "ci",
      "qa_modes": ["evidence", "promotion"],
      "receipt_origins": ["ci_pr", "ci_release"],
      "required_dimensions": ["routes", "devices", "accessibility", "visual", "runtime", "change_checklist"],
      "gate": "The adopted profile decides required checks; affected UI jobs must fail closed instead of silently skipping."
    },
    {
      "tier_id": "release",
      "qa_modes": ["promotion", "release_readiness"],
      "receipt_origins": ["ci_release", "protected_manual", "provider"],
      "required_dimensions": ["routes", "devices", "accessibility", "visual", "runtime", "change_checklist"],